{
  "$schema": "https://json-schema.org/draft/2020-12/schema",
  "title": "Extension Surface",
  "type": "object",
  "required": [
    "version",
    "matches",
    "badges",
    "popovers"
  ],
  "properties": {
    "version": {
      "type": "string"
    },
    "matches": {
      "type": "array",
      "items": { "type": "object" }
    },
    "badges": {
      "type": "array",
      "items": { "type": "object" }
    },
    "popovers": {
      "type": "array",
      "items": { "type": "object" }
    }
  },
  "additionalProperties": false
}
